{
  "format_version": "1.1",
  "id": "connector-8way-white-v1",
  "name": "8-Way Connector (White)",
  "category": "connector",
  "mesh_file": "meshes/connector-8way-white.glb",
  "default_color": "#FFFFFF",
  "mass_grams": 3.6,
  "ports": [
    {
      "id": "N",
      "position": [
        12.5,
        0.0,
        0.0
      ],
      "direction": [
        1.0,
        0.0,
        0.0
      ],
      "mate_type": "rod_hole",
      "accepts": [
        "rod_end",
        "rod_side"
      ],
      "allowed_angles_deg": [
        0,
        45,
        90,
        135,
        180,
        225,
        270,
        315
      ]
    },
    {
      "id": "NE",
      "position": [
        8.84,
        8.84,
        0.0
      ],
      "direction": [
        0.707,
        0.707,
        0.0
      ],
      "mate_type": "rod_hole",
      "accepts": [
        "rod_end",
        "rod_side"
      ],
      "allowed_angles_deg": [
        0,
        45,
        90,
        135,
        180,
        225,
        270,
        315
      ]
    },
    {
      "id": "E",
      "position": [
        0.0,
        12.5,
        0.0
      ],
      "direction": [
        0.0,
        1.0,
        0.0
      ],
      "mate_type": "rod_hole",
      "accepts": [
        "rod_end",
        "rod_side"
      ],
      "allowed_angles_deg": [
        0,
        45,
        90,
        135,
        180,
        225,
        270,
        315
      ]
    },
    {
      "id": "SE",
      "position": [
        -8.84,
        8.84,
        0.0
      ],
      "direction": [
        -0.707,
        0.707,
        0.0
      ],
      "mate_type": "rod_hole",
      "accepts": [
        "rod_end",
        "rod_side"
      ],
      "allowed_angles_deg": [
        0,
        45,
        90,
        135,
        180,
        225,
        270,
        315
      ]
    },
    {
      "id": "S",
      "position": [
        -12.5,
        0.0,
        0.0
      ],
      "direction": [
        -1.0,
        0.0,
        0.0
      ],
      "mate_type": "rod_hole",
      "accepts": [
        "rod_end",
        "rod_side"
      ],
      "allowed_angles_deg": [
        0,
        45,
        90,
        135,
        180,
        225,
        270,
        315
      ]
    },
    {
      "id": "SW",
      "position": [
        -8.84,
        -8.84,
        0.0
      ],
      "direction": [
        -0.707,
        -0.707,
        0.0
      ],
      "mate_type": "rod_hole",
      "accepts": [
        "rod_end",
        "rod_side"
      ],
      "allowed_angles_deg": [
        0,
        45,
        90,
        135,
        180,
        225,
        270,
        315
      ]
    },
    {
      "id": "W",
      "position": [
        0.0,
        -12.5,
        0.0
      ],
      "direction": [
        0.0,
        -1.0,
        0.0
      ],
      "mate_type": "rod_hole",
      "accepts": [
        "rod_end",
        "rod_side"
      ],
      "allowed_angles_deg": [
        0,
        45,
        90,
        135,
        180,
        225,
        270,
        315
      ]
    },
    {
      "id": "NW",
      "position": [
        8.84,
        -8.84,
        0.0
      ],
      "direction": [
        0.707,
        -0.707,
        0.0
      ],
      "mate_type": "rod_hole",
      "accepts": [
        "rod_end",
        "rod_side"
      ],
      "allowed_angles_deg": [
        0,
        45,
        90,
        135,
        180,
        225,
        270,
        315
      ]
    },
    {
      "id": "center",
      "position": [
        0.0,
        0.0,
        0.0
      ],
      "direction": [
        0.0,
        0.0,
        1.0
      ],
      "mate_type": "rod_hole",
      "accepts": [
        "rod_end"
      ],
      "allowed_angles_deg": [
        0,
        90,
        180,
        270
      ]
    }
  ]
}