{
  "format_version": "1.1",
  "id": "connector-7way-blue-v1",
  "name": "Blue 7-Way 3D Connector",
  "category": "connector",
  "mesh_file": "meshes/connector-7way-blue.glb",
  "default_color": "#0070C0",
  "mass_grams": 2.8,
  "ports": [
    {
      "id": "A",
      "position": [12.7, 0.0, 0.0],
      "direction": [1.0, 0.0, 0.0],
      "mate_type": "rod_hole",
      "accepts": ["rod_end", "rod_side"],
      "allowed_angles_deg": [0, 90, 180, 270],
      "tolerance_mm": 0.2
    },
    {
      "id": "B",
      "position": [8.98, 8.98, 0.0],
      "direction": [0.7071, 0.7071, 0.0],
      "mate_type": "rod_hole",
      "accepts": ["rod_end", "rod_side"],
      "allowed_angles_deg": [0, 90, 180, 270],
      "tolerance_mm": 0.2
    },
    {
      "id": "C",
      "position": [0.0, 12.7, 0.0],
      "direction": [0.0, 1.0, 0.0],
      "mate_type": "rod_hole",
      "accepts": ["rod_end", "rod_side"],
      "allowed_angles_deg": [0, 90, 180, 270],
      "tolerance_mm": 0.2
    },
    {
      "id": "D",
      "position": [-8.98, 8.98, 0.0],
      "direction": [-0.7071, 0.7071, 0.0],
      "mate_type": "rod_hole",
      "accepts": ["rod_end", "rod_side"],
      "allowed_angles_deg": [0, 90, 180, 270],
      "tolerance_mm": 0.2
    },
    {
      "id": "E",
      "position": [-12.7, 0.0, 0.0],
      "direction": [-1.0, 0.0, 0.0],
      "mate_type": "rod_hole",
      "accepts": ["rod_end", "rod_side"],
      "allowed_angles_deg": [0, 90, 180, 270],
      "tolerance_mm": 0.2
    },
    {
      "id": "F",
      "position": [-8.98, -8.98, 0.0],
      "direction": [-0.7071, -0.7071, 0.0],
      "mate_type": "rod_hole",
      "accepts": ["rod_end", "rod_side"],
      "allowed_angles_deg": [0, 90, 180, 270],
      "tolerance_mm": 0.2
    },
    {
      "id": "G",
      "position": [0.0, -12.7, 0.0],
      "direction": [0.0, -1.0, 0.0],
      "mate_type": "rod_hole",
      "accepts": ["rod_end", "rod_side"],
      "allowed_angles_deg": [0, 90, 180, 270],
      "tolerance_mm": 0.2
    },
    {
      "id": "slot",
      "position": [0.0, 0.0, 0.0],
      "direction": [0.7071, -0.7071, 0.0],
      "mate_type": "connector_slot",
      "accepts": ["connector_slot"],
      "allowed_angles_deg": [90, 270],
      "tolerance_mm": 0.2
    },
    {
      "id": "center",
      "position": [0.0, 0.0, 0.0],
      "direction": [0.0, 0.0, 1.0],
      "mate_type": "rod_hole",
      "accepts": ["rod_end"],
      "allowed_angles_deg": [0, 90, 180, 270],
      "tolerance_mm": 0.2
    }
  ]
}