{
  "format_version": "1.1",
  "id": "connector-4way-yellow-v1",
  "name": "Yellow 4-Way Connector (90°)",
  "category": "connector",
  "mesh_file": "meshes/connector-4way-yellow.glb",
  "default_color": "#FFD700",
  "mass_grams": 1.8,
  "ports": [
    {
      "id": "N",
      "position": [12.7, 0.0, 0.0],
      "direction": [1.0, 0.0, 0.0],
      "mate_type": "rod_hole",
      "accepts": ["rod_end", "rod_side"],
      "allowed_angles_deg": [0, 90, 180, 270],
      "tolerance_mm": 0.2
    },
    {
      "id": "E",
      "position": [0.0, 12.7, 0.0],
      "direction": [0.0, 1.0, 0.0],
      "mate_type": "rod_hole",
      "accepts": ["rod_end", "rod_side"],
      "allowed_angles_deg": [0, 90, 180, 270],
      "tolerance_mm": 0.2
    },
    {
      "id": "S",
      "position": [-12.7, 0.0, 0.0],
      "direction": [-1.0, 0.0, 0.0],
      "mate_type": "rod_hole",
      "accepts": ["rod_end", "rod_side"],
      "allowed_angles_deg": [0, 90, 180, 270],
      "tolerance_mm": 0.2
    },
    {
      "id": "W",
      "position": [0.0, -12.7, 0.0],
      "direction": [0.0, -1.0, 0.0],
      "mate_type": "rod_hole",
      "accepts": ["rod_end", "rod_side"],
      "allowed_angles_deg": [0, 90, 180, 270],
      "tolerance_mm": 0.2
    },
    {
      "id": "center",
      "position": [0.0, 0.0, 0.0],
      "direction": [0.0, 0.0, 1.0],
      "mate_type": "rod_hole",
      "accepts": ["rod_end"],
      "allowed_angles_deg": [0, 90, 180, 270],
      "tolerance_mm": 0.2
    }
  ]
}
