{
  "format_version": "1.1",
  "id": "connector-1way-grey-v1",
  "name": "Grey 1-Way End Cap",
  "category": "connector",
  "mesh_file": "meshes/connector-1way-grey.glb",
  "default_color": "#606060",
  "mass_grams": 0.8,
  "ports": [
    {
      "id": "A",
      "position": [12.7, 0.0, 0.0],
      "direction": [1.0, 0.0, 0.0],
      "mate_type": "rod_hole",
      "accepts": ["rod_end", "rod_side"],
      "allowed_angles_deg": [0, 90, 180, 270],
      "tolerance_mm": 0.2
    }
  ]
}
