{
  "format_version": "1.1",
  "id": "rod-54-blue-v1",
  "name": "Blue Rod (54 mm)",
  "category": "rod",
  "mesh_file": "meshes/rod-54-blue.glb",
  "default_color": "#0070C0",
  "mass_grams": 1.2,
  "ports": [
    {
      "id": "end1",
      "position": [0.0, 0.0, 0.0],
      "direction": [-1.0, 0.0, 0.0],
      "mate_type": "rod_end",
      "accepts": ["rod_hole"],
      "allowed_angles_deg": [0],
      "tolerance_mm": 0.2
    },
    {
      "id": "end2",
      "position": [54.0, 0.0, 0.0],
      "direction": [1.0, 0.0, 0.0],
      "mate_type": "rod_end",
      "accepts": ["rod_hole"],
      "allowed_angles_deg": [0],
      "tolerance_mm": 0.2
    },
    {
      "id": "center_axial_1",
      "position": [27.0, 0.0, 0.0],
      "direction": [-1.0, 0.0, 0.0],
      "mate_type": "rod_end",
      "accepts": ["rod_hole"],
      "allowed_angles_deg": [0],
      "tolerance_mm": 0.2
    },
    {
      "id": "center_axial_2",
      "position": [27.0, 0.0, 0.0],
      "direction": [1.0, 0.0, 0.0],
      "mate_type": "rod_end",
      "accepts": ["rod_hole"],
      "allowed_angles_deg": [0],
      "tolerance_mm": 0.2
    },
    {
      "id": "center_tangent",
      "position": [27.0, 0.0, 0.0],
      "direction": [0.0, 1.0, 0.0],
      "mate_type": "rod_side",
      "accepts": ["rod_hole", "clip"],
      "allowed_angles_deg": [0, 90, 180, 270],
      "tolerance_mm": 0.2
    }
  ]
}
