{
  "format_version": "1.1",
  "id": "connector-4way-3d-silver-v1",
  "name": "4-Way 3D Connector (Silver)",
  "category": "connector",
  "mesh_file": "meshes/connector-4way-3d-silver.glb",
  "default_color": "#CCCCCC",
  "mass_grams": 2.3,
  "ports": [
    {
      "id": "N",
      "position": [
        12.5,
        0.0,
        0.0
      ],
      "direction": [
        1.0,
        0.0,
        0.0
      ],
      "mate_type": "rod_hole",
      "accepts": [
        "rod_end",
        "rod_side"
      ],
      "allowed_angles_deg": [
        0,
        90,
        180,
        270
      ]
    },
    {
      "id": "E",
      "position": [
        0.0,
        12.5,
        0.0
      ],
      "direction": [
        0.0,
        1.0,
        0.0
      ],
      "mate_type": "rod_hole",
      "accepts": [
        "rod_end",
        "rod_side"
      ],
      "allowed_angles_deg": [
        0,
        90,
        180,
        270
      ]
    },
    {
      "id": "S",
      "position": [
        -12.5,
        0.0,
        0.0
      ],
      "direction": [
        -1.0,
        0.0,
        0.0
      ],
      "mate_type": "rod_hole",
      "accepts": [
        "rod_end",
        "rod_side"
      ],
      "allowed_angles_deg": [
        0,
        90,
        180,
        270
      ]
    },
    {
      "id": "Up",
      "position": [
        0.0,
        0.0,
        12.5
      ],
      "direction": [
        0.0,
        0.0,
        1.0
      ],
      "mate_type": "rod_hole",
      "accepts": [
        "rod_end",
        "rod_side"
      ],
      "allowed_angles_deg": [
        0,
        90,
        180,
        270
      ]
    },
    {
      "id": "center",
      "position": [
        0.0,
        0.0,
        0.0
      ],
      "direction": [
        0.0,
        0.0,
        1.0
      ],
      "mate_type": "rod_hole",
      "accepts": [
        "rod_end"
      ],
      "allowed_angles_deg": [
        0,
        90,
        180,
        270
      ]
    }
  ]
}