{
  "format_version": "1.1",
  "id": "rod-128-red-v1",
  "name": "Red Rod (128 mm)",
  "category": "rod",
  "mesh_file": "meshes/rod-128-red.glb",
  "default_color": "#E21B1B",
  "mass_grams": 2.0,
  "ports": [
    {
      "id": "end1",
      "position": [
        0.0,
        0.0,
        0.0
      ],
      "direction": [
        -1.0,
        0.0,
        0.0
      ],
      "mate_type": "rod_end",
      "accepts": [
        "rod_hole",
        "rotational_hole",
        "slider_hole"
      ],
      "allowed_angles_deg": [
        0
      ],
      "tolerance_mm": 0.2
    },
    {
      "id": "end2",
      "position": [
        128.0,
        0.0,
        0.0
      ],
      "direction": [
        1.0,
        0.0,
        0.0
      ],
      "mate_type": "rod_end",
      "accepts": [
        "rod_hole",
        "rotational_hole",
        "slider_hole"
      ],
      "allowed_angles_deg": [
        0
      ],
      "tolerance_mm": 0.2
    },
    {
      "id": "center_axial_1",
      "position": [
        64.0,
        0.0,
        0.0
      ],
      "direction": [
        -1.0,
        0.0,
        0.0
      ],
      "mate_type": "rod_end",
      "accepts": [
        "rod_hole",
        "rotational_hole",
        "slider_hole"
      ],
      "allowed_angles_deg": [
        0
      ],
      "tolerance_mm": 0.2
    },
    {
      "id": "center_axial_2",
      "position": [
        64.0,
        0.0,
        0.0
      ],
      "direction": [
        1.0,
        0.0,
        0.0
      ],
      "mate_type": "rod_end",
      "accepts": [
        "rod_hole",
        "rotational_hole",
        "slider_hole"
      ],
      "allowed_angles_deg": [
        0
      ],
      "tolerance_mm": 0.2
    },
    {
      "id": "center_tangent_y_pos",
      "position": [
        64.0,
        0.0,
        0.0
      ],
      "direction": [
        0.0,
        1.0,
        0.0
      ],
      "mate_type": "rod_side",
      "accepts": [
        "rod_hole",
        "clip",
        "rotational_hole",
        "slider_hole"
      ],
      "allowed_angles_deg": [
        0,
        90,
        180,
        270
      ],
      "tolerance_mm": 0.2
    },
    {
      "id": "center_tangent_y_neg",
      "position": [
        64.0,
        0.0,
        0.0
      ],
      "direction": [
        0.0,
        -1.0,
        0.0
      ],
      "mate_type": "rod_side",
      "accepts": [
        "rod_hole",
        "clip",
        "rotational_hole",
        "slider_hole"
      ],
      "allowed_angles_deg": [
        0,
        90,
        180,
        270
      ],
      "tolerance_mm": 0.2
    },
    {
      "id": "center_tangent_z_pos",
      "position": [
        64.0,
        0.0,
        0.0
      ],
      "direction": [
        0.0,
        0.0,
        1.0
      ],
      "mate_type": "rod_side",
      "accepts": [
        "rod_hole",
        "clip",
        "rotational_hole",
        "slider_hole"
      ],
      "allowed_angles_deg": [
        0,
        90,
        180,
        270
      ],
      "tolerance_mm": 0.2
    },
    {
      "id": "center_tangent_z_neg",
      "position": [
        64.0,
        0.0,
        0.0
      ],
      "direction": [
        0.0,
        0.0,
        -1.0
      ],
      "mate_type": "rod_side",
      "accepts": [
        "rod_hole",
        "clip",
        "rotational_hole",
        "slider_hole"
      ],
      "allowed_angles_deg": [
        0,
        90,
        180,
        270
      ],
      "tolerance_mm": 0.2
    }
  ]
}